{
  "kind": "project",
  "schemaVersion": 1,
  "sourceProjectId": "p-launch-1",
  "name": "Product Launch",
  "preset": "corporate",
  "brainstorm": {
    "id": "b-root",
    "title": "Launch ideas",
    "children": [
      {
        "id": "b-1",
        "title": "Landing page before beta ends",
        "notes": "Deadline-driven: reuse beta signup flow, swap copy and hero."
      },
      { "id": "b-2", "title": "Press kit for tech blogs" },
      {
        "id": "b-3",
        "title": "Launch day livestream",
        "children": [
          {
            "id": "b-3a",
            "title": "Demo script",
            "notes": "3-minute guided tour: setup, one wow-moment, pricing."
          }
        ]
      }
    ]
  },
  "map": {
    "id": "m-root",
    "title": "Product Launch",
    "role": "theme",
    "children": [
      {
        "id": "m-marketing",
        "title": "Marketing",
        "side": "right",
        "role": "main-branch",
        "notes": "Owned by the growth team. Ship order: landing page, then press kit.",
        "children": [
          { "id": "m-m1", "title": "Landing page refresh", "role": "task" },
          { "id": "m-m2", "title": "Press kit for tech blogs", "role": "task" }
        ]
      },
      {
        "id": "m-product",
        "title": "Product",
        "side": "left",
        "role": "main-branch",
        "children": [
          { "id": "m-p1", "title": "Onboarding polish", "role": "task" },
          { "id": "m-p2", "title": "Which pricing tier at launch?", "role": "question" },
          { "id": "m-m3", "title": "Launch day livestream", "role": "idea" }
        ]
      }
    ]
  }
}
